{
  "$schema": "http://json-schema.org/draft-07/schema#",
  "$id": "https://github.com/37chengshan/eduevidence/schemas/intervention.schema.json",
  "title": "TeachingIntervention",
  "description": "A minimal verifiable pilot intervention. EduEvidence NEVER recommends full deployment directly — it always produces a small-scale, evaluable pilot with stop conditions. 扩展字段一律放在 extensions 内。",
  "type": "object",
  "additionalProperties": false,
  "required": [
    "decision",
    "pilot_duration",
    "stop_conditions"
  ],
  "properties": {
    "decision": {
      "type": "string",
      "enum": [
        "adopt",
        "pilot",
        "reject",
        "insufficient_evidence"
      ]
    },
    "target_learners": {
      "type": "string"
    },
    "learning_goals": {
      "type": "array",
      "items": {
        "type": "string"
      }
    },
    "pilot_duration": {
      "type": "string",
      "examples": [
        "8_weeks"
      ]
    },
    "phase_1": {
      "type": "object",
      "additionalProperties": true,
      "description": "Phase structure: name, activities, ai_usage_rule, outcome_check.",
      "properties": {
        "name": {
          "type": "string"
        },
        "activities": {
          "type": "array",
          "items": {
            "type": "string"
          }
        },
        "ai_usage_rule": {
          "type": "string"
        },
        "outcome_check": {
          "type": "string"
        }
      }
    },
    "phase_2": {
      "type": "object",
      "additionalProperties": true
    },
    "phase_3": {
      "type": "object",
      "additionalProperties": true
    },
    "phase_4": {
      "type": "object",
      "additionalProperties": true
    },
    "ai_usage_policy": {
      "type": "string",
      "description": "Explicit allowed/forbidden AI usage rules for students."
    },
    "teacher_role": {
      "type": "string"
    },
    "student_role": {
      "type": "string"
    },
    "reflection_requirement": {
      "type": "string",
      "description": "e.g. students must explain key logic generated by AI."
    },
    "assessment": {
      "type": "string"
    },
    "risk_control": {
      "type": "array",
      "items": {
        "type": "string"
      }
    },
    "stop_conditions": {
      "type": "array",
      "items": {
        "type": "string"
      }
    },
    "evidence_alignment": {
      "type": "array",
      "items": {
        "type": "string"
      },
      "description": "evidence_id(s) that this intervention traces back to."
    },
    "extensions": {
      "type": "object",
      "description": "结构化扩展字段的统一容器（P1-01）。未列入本 schema 的字段必须放在这里，禁止在顶层新增属性。",
      "additionalProperties": true
    },
    "target_population": {
      "type": "string",
      "minLength": 1,
      "description": "Target population for a non-teaching intervention."
    }
  },
  "anyOf": [
    {
      "required": [
        "target_learners"
      ]
    },
    {
      "required": [
        "target_population"
      ]
    }
  ]
}
